{
  "$schema": "../../../schemas/task-preset-plugin/prompt-package.schema.json",
  "version": "1.0.0",
  "templateEngine": "handlebars",
  "defaultLocale": "en-US",
  "supportedLocales": [
    "en-US",
    "zh-CN"
  ],
  "inputs": [
    {
      "name": "projectPath",
      "source": "system",
      "required": true,
      "description": "Absolute path to the selected project root."
    },
    {
      "name": "repositoryPath",
      "source": "computed-context",
      "description": "Resolved repository identity hint for the selected project."
    },
    {
      "name": "scope",
      "source": "task-preset-input",
      "required": true,
      "description": "Resolved AGENTS.md/CLAUDE.md update scope for the selected project."
    },
    {
      "name": "targetScopeMarkdown",
      "source": "task-preset-input",
      "required": true,
      "description": "Frontend-composed markdown block describing the target AGENTS.md and CLAUDE.md files for this run."
    }
  ],
  "rendering": {
    "strictVariables": false,
    "trimBlocks": true
  },
  "locales": {
    "en-US": {
      "systemTemplate": "./templates/en-US/system.md",
      "userTemplate": "./templates/en-US/user.hbs"
    },
    "zh-CN": {
      "systemTemplate": "./templates/zh-CN/system.md",
      "userTemplate": "./templates/zh-CN/user.hbs"
    }
  }
}
